{"schema":1,"slug":"caribepack","name":"CaribePack","tagline":"","bundleId":"com.barolit.caribepack","androidApplicationId":"com.barolit.caribepackapp","urlScheme":"caribepack","appGroup":"group.com.barolit.caribepack","locale":"es-DO","currency":"RD$","weightUnit":"lb","fonts":{"head":"Myriad","body":"Myriad"},"radius":{"sm":8,"md":16,"lg":24},"assets":{"logoWide":"images/caribepack/brand_logo.png","logoMark":"images/caribepack/icon.png"},"palettes":{"light":{"primary":"#203D87","onPrimary":"#FFFFFF","secondary":"#F5851E","onSecondary":"#291300"},"dark":{"primary":"#7898E7","onPrimary":"#0A1738","secondary":"#FFB15F","onSecondary":"#291300"}},"capabilities":{"delivery":true,"payments":true,"points":true,"prealerts":true,"widgets":true,"notifications":true},"navigation":{"tabs":["news","branches","home","services","more"]}}
