{"schema":1,"slug":"telo","name":"Telo","tagline":"","bundleId":"com.barolit.telo","urlScheme":"telo","appGroup":"group.com.barolit.telo","locale":"es-DO","currency":"RD$","weightUnit":"lb","fonts":{"head":"Myriad","body":"Myriad"},"radius":{"sm":8,"md":16,"lg":24},"assets":{"logoWide":"images/telo/brand_logo.png","logoMark":"images/telo/icon.png"},"palettes":{"light":{"primary":"#D96941","onPrimary":"#FFFFFF","secondary":"#02243D","onSecondary":"#FFFFFF"},"dark":{"primary":"#E89A7D","onPrimary":"#2B1007","secondary":"#6A96B4","onSecondary":"#071823"}},"capabilities":{"delivery":true,"payments":true,"points":true,"prealerts":true,"widgets":true,"notifications":true},"navigation":{"tabs":["news","branches","home","calculator","more"]}}
