{"schema":1,"slug":"atiempo","name":"A Tiempo","tagline":"","bundleId":"com.barolit.atiempo","urlScheme":"atiempo","appGroup":"group.com.barolit.atiempo","locale":"es-DO","currency":"RD$","weightUnit":"lb","fonts":{"head":"Myriad","body":"Myriad"},"radius":{"sm":8,"md":16,"lg":24},"assets":{"logoWide":"images/atiempo/brand_logo.png","logoMark":"images/atiempo/icon.png"},"palettes":{"light":{"primary":"#1A3D7A","onPrimary":"#FFFFFF","secondary":"#C7342C","onSecondary":"#FFFFFF"},"dark":{"primary":"#7DA7E8","onPrimary":"#0B1A33","secondary":"#E87B75","onSecondary":"#2B0D0B"}},"capabilities":{"delivery":true,"payments":true,"points":true,"prealerts":true,"widgets":true,"notifications":true},"navigation":{"tabs":["news","branches","home","calculator","more"]}}
