{"schema":1,"slug":"swoop","name":"Swoop","tagline":"","bundleId":"com.barolit.swoop","urlScheme":"swoop","appGroup":"group.com.barolit.swoop","locale":"es-DO","currency":"US$","weightUnit":"lb","fonts":{"head":"Myriad","body":"Myriad"},"radius":{"sm":8,"md":16,"lg":24},"assets":{"logoWide":"images/swoop/brand_logo.png","logoMark":"images/swoop/icon.png"},"palettes":{"light":{"primary":"#220E57","onPrimary":"#FFFFFF","secondary":"#05C204","onSecondary":"#092A09"},"dark":{"primary":"#9B86D4","onPrimary":"#1B1231","secondary":"#67DE66","onSecondary":"#092A09"}},"capabilities":{"delivery":true,"payments":true,"points":true,"prealerts":true,"widgets":true,"notifications":true},"navigation":{"tabs":["news","branches","home","services","more"]}}
