{"schema":1,"slug":"taino","name":"Taino","tagline":"","bundleId":"com.barolit.taino","urlScheme":"taino","appGroup":"group.com.barolit.taino","locale":"es-DO","currency":"RD$","weightUnit":"lb","fonts":{"head":"Myriad","body":"Myriad"},"radius":{"sm":8,"md":16,"lg":24},"assets":{"logoWide":"images/taino/brand_logo.png","logoMark":"images/taino/icon.png"},"palettes":{"light":{"primary":"#B42129","onPrimary":"#FFFFFF","secondary":"#D2AB77","onSecondary":"#271B0C"},"dark":{"primary":"#E4787D","onPrimary":"#31090C","secondary":"#DCC29F","onSecondary":"#271B0C"}},"capabilities":{"delivery":true,"payments":true,"points":true,"prealerts":true,"widgets":true,"notifications":true},"navigation":{"tabs":["news","branches","home","calculator","more"]}}
