{"schema":1,"slug":"almapaq","name":"AlmaPaq","tagline":"","bundleId":"com.barolit.almapaq","urlScheme":"almapaq","appGroup":"group.com.barolit.almapaq","locale":"es-DO","currency":"RD$","weightUnit":"lb","fonts":{"head":"Myriad","body":"Myriad"},"radius":{"sm":8,"md":16,"lg":24},"assets":{"logoWide":"images/almapaq/brand_logo.png","logoMark":"images/almapaq/icon.png"},"palettes":{"light":{"primary":"#E96F2B","onPrimary":"#FFFFFF","secondary":"#0E639F","onSecondary":"#FFFFFF"},"dark":{"primary":"#E96F2B","onPrimary":"#24120A","secondary":"#5DA9DD","onSecondary":"#08141B"}},"capabilities":{"delivery":true,"payments":true,"points":true,"prealerts":true,"widgets":true,"notifications":true},"navigation":{"tabs":["news","branches","home","calculator","more"]}}
