{"schema":1,"slug":"tdexpress","name":"TD Express","tagline":"","bundleId":"com.barolit.tdexpress","urlScheme":"tdexpress","appGroup":"group.com.barolit.tdexpress","locale":"es-DO","currency":"RD$","weightUnit":"lb","fonts":{"head":"Myriad","body":"Myriad"},"radius":{"sm":8,"md":16,"lg":24},"assets":{"logoWide":"images/tdexpress/brand_logo.png","logoMark":"images/tdexpress/icon.png"},"palettes":{"light":{"primary":"#0A1ACC","onPrimary":"#FFFFFF","secondary":"#FF8000","onSecondary":"#2B1500"},"dark":{"primary":"#8892F1","onPrimary":"#10143C","secondary":"#FFB35C","onSecondary":"#2B1500"}},"capabilities":{"delivery":true,"payments":true,"points":true,"prealerts":true,"widgets":true,"notifications":true},"navigation":{"tabs":["news","branches","home","calculator","more"]}}
