{"schema":1,"slug":"qm","name":"QM Cargo","tagline":"","bundleId":"com.barolit.qm","urlScheme":"qm","appGroup":"group.com.barolit.qm","locale":"es-DO","currency":"RD$","weightUnit":"lb","fonts":{"head":"Myriad","body":"Myriad"},"radius":{"sm":8,"md":16,"lg":24},"assets":{"logoWide":"images/qm/brand_logo.png","logoMark":"images/qm/icon.png"},"palettes":{"light":{"primary":"#1E106C","onPrimary":"#FFFFFF","secondary":"#00AA4F","onSecondary":"#FFFFFF"},"dark":{"primary":"#9387DF","onPrimary":"#17102C","secondary":"#65D792","onSecondary":"#092A16"}},"capabilities":{"delivery":true,"payments":true,"points":true,"prealerts":true,"widgets":true,"notifications":true},"navigation":{"tabs":["news","branches","home","calculator","more"]}}
