{"schema":1,"slug":"mcccargo","name":"MCC Cargo","tagline":"","bundleId":"com.barolit.mcccargo","urlScheme":"mcccargo","appGroup":"group.com.barolit.mcccargo","locale":"es-DO","currency":"RD$","weightUnit":"lb","fonts":{"head":"Myriad","body":"Myriad"},"radius":{"sm":8,"md":16,"lg":24},"assets":{"logoWide":"images/mcccargo/brand_logo.png","logoMark":"images/mcccargo/icon.png"},"palettes":{"light":{"primary":"#213263","onPrimary":"#FFFFFF","secondary":"#279AF1","onSecondary":"#FFFFFF"},"dark":{"primary":"#849AD8","onPrimary":"#10162B","secondary":"#75BDF4","onSecondary":"#09202F"}},"capabilities":{"delivery":true,"payments":true,"points":true,"prealerts":true,"widgets":true,"notifications":true},"navigation":{"tabs":["news","branches","home","calculator","more"]}}
