{"schema":1,"slug":"cargospot","name":"CargoSpot","tagline":"","bundleId":"com.barolit.cargospot","urlScheme":"cargospot","appGroup":"group.com.barolit.cargospot","locale":"es-DO","currency":"RD$","weightUnit":"lb","fonts":{"head":"Myriad","body":"Myriad"},"radius":{"sm":8,"md":16,"lg":24},"assets":{"logoWide":"images/cargospot/brand_logo.png","logoMark":"images/cargospot/icon.png"},"palettes":{"light":{"primary":"#0D0D0D","onPrimary":"#FFFFFF","secondary":"#E69624","onSecondary":"#251500"},"dark":{"primary":"#EEEEEE","onPrimary":"#111111","secondary":"#F0B965","onSecondary":"#251500"}},"capabilities":{"delivery":true,"payments":true,"points":true,"prealerts":true,"widgets":true,"notifications":true},"navigation":{"tabs":["news","branches","home","calculator","more"]}}
