{"schema":1,"slug":"encargopaq","name":"EncargoPaq","tagline":"","bundleId":"com.barolit.encargopaq","urlScheme":"encargopaq","appGroup":"group.com.barolit.encargopaq","locale":"es-DO","currency":"RD$","weightUnit":"lb","fonts":{"head":"Myriad","body":"Myriad"},"radius":{"sm":8,"md":16,"lg":24},"assets":{"logoWide":"images/encargopaq/brand_logo.png","logoMark":"images/encargopaq/icon.png"},"palettes":{"light":{"primary":"#0265A1","onPrimary":"#FFFFFF","secondary":"#DE4A54","onSecondary":"#FFFFFF"},"dark":{"primary":"#64A9D2","onPrimary":"#071C29","secondary":"#EF8990","onSecondary":"#351013"}},"capabilities":{"delivery":true,"payments":true,"points":true,"prealerts":true,"widgets":true,"notifications":true},"navigation":{"tabs":["news","branches","home","calculator","more"]}}
