{"schema":1,"slug":"clickpack","name":"ClickPack","tagline":"","bundleId":"com.barolit.clickpack","urlScheme":"clickpack","appGroup":"group.com.barolit.clickpack","locale":"es-DO","currency":"RD$","weightUnit":"lb","fonts":{"head":"Myriad","body":"Myriad"},"radius":{"sm":8,"md":16,"lg":24},"assets":{"logoWide":"images/clickpack/brand_logo.png","logoMark":"images/clickpack/icon.png"},"palettes":{"light":{"primary":"#009CD7","onPrimary":"#FFFFFF","secondary":"#757575","onSecondary":"#FFFFFF"},"dark":{"primary":"#68C8EA","onPrimary":"#09222C","secondary":"#BDBDBD","onSecondary":"#202020"}},"capabilities":{"delivery":true,"payments":true,"points":true,"prealerts":true,"widgets":true,"notifications":true},"navigation":{"tabs":["news","branches","home","calculator","more"]}}
