{"schema":1,"slug":"tls","name":"TLS","tagline":"","bundleId":"com.barolit.tls","urlScheme":"tls","appGroup":"group.com.barolit.tls","locale":"es-DO","currency":"RD$","weightUnit":"lb","fonts":{"head":"Rubik","body":"Rubik"},"radius":{"sm":8,"md":16,"lg":24},"assets":{"logoWide":"images/tls/brand_logo.png","logoMark":"images/tls/icon.png"},"passwordReset":{"urlTemplate":"https://tls.com.do/en/wp-json/v2/forgotpwd/{email}","headerName":"X-Api-key","headerValue":"eyJhbGciOiJIUzI1NiIsInR5cCI6IkpXVCJ9"},"palettes":{"light":{"primary":"#1C6FB7","onPrimary":"#FFFFFF","secondary":"#2F5069","onSecondary":"#FFFFFF"},"dark":{"primary":"#70ADE1","onPrimary":"#092238","secondary":"#91AABC","onSecondary":"#15242D"}},"capabilities":{"delivery":true,"payments":true,"points":true,"prealerts":true,"widgets":true,"notifications":true,"pushTopicUsesSessionId":true},"navigation":{"tabs":["news","branches","home","calculator","more"]}}
