{"schema":1,"slug":"cainca","name":"Cainca","tagline":"","bundleId":"com.barolit.cainca","urlScheme":"cainca","appGroup":"group.com.barolit.cainca","locale":"es-DO","currency":"RD$","weightUnit":"lb","fonts":{"head":"Myriad","body":"Myriad"},"radius":{"sm":8,"md":16,"lg":24},"assets":{"logoWide":"images/cainca/brand_logo.png","logoMark":"images/cainca/icon.png"},"palettes":{"light":{"primary":"#C2DEFF","onPrimary":"#10243B","secondary":"#1987DC","onSecondary":"#FFFFFF"},"dark":{"primary":"#72B7EC","onPrimary":"#0A2233","secondary":"#486582","onSecondary":"#FFFFFF"}},"capabilities":{"delivery":true,"payments":true,"points":true,"prealerts":true,"widgets":true,"notifications":true},"navigation":{"tabs":["news","branches","home","calculator","more"]}}
