{"schema":1,"slug":"flypack","name":"FlyPack","tagline":"","bundleId":"com.barolit.flypack","urlScheme":"flypack","appGroup":"group.com.barolit.flypack","locale":"es-DO","currency":"RD$","weightUnit":"lb","fonts":{"head":"Myriad","body":"Myriad"},"radius":{"sm":8,"md":16,"lg":24},"assets":{"logoWide":"images/flypack/brand_logo.png","logoMark":"images/flypack/icon.png"},"palettes":{"light":{"primary":"#325AAE","onPrimary":"#FFFFFF","secondary":"#0091E7","onSecondary":"#FFFFFF"},"dark":{"primary":"#87A5E5","onPrimary":"#101B38","secondary":"#65BFF2","onSecondary":"#08202D"}},"capabilities":{"delivery":true,"payments":true,"points":true,"prealerts":true,"widgets":true,"notifications":true},"navigation":{"tabs":["news","branches","home","calculator","more"]}}
