{"schema":1,"slug":"boxpaq","name":"BoxPaq","tagline":"","bundleId":"com.barolit.boxpaq","urlScheme":"boxpaq","appGroup":"group.com.barolit.boxpaq","locale":"es-DO","currency":"RD$","weightUnit":"lb","fonts":{"head":"Myriad","body":"Myriad"},"radius":{"sm":8,"md":16,"lg":24},"assets":{"logoWide":"images/boxpaq/brand_logo.png","logoMark":"images/boxpaq/icon.png"},"palettes":{"light":{"primary":"#F05A34","onPrimary":"#FFFFFF","secondary":"#BE8B59","onSecondary":"#211509"},"dark":{"primary":"#F58A6E","onPrimary":"#2B0D05","secondary":"#D6AE86","onSecondary":"#211509"}},"capabilities":{"delivery":true,"payments":true,"points":true,"prealerts":true,"widgets":true,"notifications":true},"navigation":{"tabs":["news","branches","home","calculator","more"]}}
