{"schema":1,"slug":"ecopaq","name":"EcoPaq","tagline":"","bundleId":"com.barolit.ecopaq","urlScheme":"ecopaq","appGroup":"group.com.barolit.ecopaq","locale":"es-DO","currency":"RD$","weightUnit":"lb","fonts":{"head":"Myriad","body":"Myriad"},"radius":{"sm":8,"md":16,"lg":24},"assets":{"logoWide":"images/ecopaq/brand_logo.png","logoMark":"images/ecopaq/icon.png"},"palettes":{"light":{"primary":"#009540","onPrimary":"#FFFFFF","secondary":"#009540","onSecondary":"#FFFFFF"},"dark":{"primary":"#61C586","onPrimary":"#082315","secondary":"#61C586","onSecondary":"#082315"}},"capabilities":{"delivery":true,"payments":true,"points":true,"prealerts":true,"widgets":true,"notifications":true},"navigation":{"tabs":["news","branches","home","calculator","more"]}}
