{"schema":1,"slug":"beexpress","name":"Be Express","tagline":"","bundleId":"com.barolit.beexpress","urlScheme":"beexpress","appGroup":"group.com.barolit.beexpress","locale":"es-DO","currency":"RD$","weightUnit":"lb","fonts":{"head":"Myriad","body":"Myriad"},"radius":{"sm":8,"md":16,"lg":24},"assets":{"logoWide":"images/beexpress/brand_logo.png","logoMark":"images/beexpress/icon.png"},"palettes":{"light":{"primary":"#F39700","onPrimary":"#241700","secondary":"#221F1F","onSecondary":"#FFFFFF"},"dark":{"primary":"#F3B64F","onPrimary":"#241700","secondary":"#BDB6B6","onSecondary":"#221F1F"}},"capabilities":{"delivery":true,"payments":true,"points":true,"prealerts":true,"widgets":true,"notifications":true},"navigation":{"tabs":["news","branches","home","calculator","more"]}}
