{"schema":1,"slug":"pintopaq","name":"PintoPaq","tagline":"","bundleId":"com.barolit.pintopaq","urlScheme":"pintopaq","appGroup":"group.com.barolit.pintopaq","locale":"es-DO","currency":"RD$","weightUnit":"lb","fonts":{"head":"Myriad","body":"Myriad"},"radius":{"sm":8,"md":16,"lg":24},"assets":{"logoWide":"images/pintopaq/brand_logo.png","logoMark":"images/pintopaq/icon.png"},"palettes":{"light":{"primary":"#21B24C","onPrimary":"#FFFFFF","secondary":"#602872","onSecondary":"#FFFFFF"},"dark":{"primary":"#71D38E","onPrimary":"#0A2513","secondary":"#B98BC7","onSecondary":"#27102E"}},"capabilities":{"delivery":true,"payments":true,"points":true,"prealerts":true,"widgets":true,"notifications":true},"navigation":{"tabs":["news","branches","home","calculator","more"]}}
