{"schema":1,"slug":"arribex","name":"Arribex","tagline":"","bundleId":"com.barolit.arribex","urlScheme":"arribex","appGroup":"group.com.barolit.arribex","locale":"es-DO","currency":"RD$","weightUnit":"lb","fonts":{"head":"Myriad","body":"Myriad"},"radius":{"sm":8,"md":16,"lg":24},"assets":{"logoWide":"images/arribex/brand_logo.png","logoMark":"images/arribex/icon.png"},"palettes":{"light":{"primary":"#F0653A","onPrimary":"#FFFFFF","secondary":"#313E61","onSecondary":"#FFFFFF"},"dark":{"primary":"#F0653A","onPrimary":"#24100A","secondary":"#8E9ABC","onSecondary":"#11151E"}},"capabilities":{"delivery":true,"payments":true,"points":true,"prealerts":true,"widgets":true,"notifications":true},"navigation":{"tabs":["news","branches","home","calculator","more"]}}
