{"schema":1,"slug":"fixocargo","name":"Fixo Cargo","tagline":"","bundleId":"com.barolit.fixocargo","urlScheme":"fixocargo","appGroup":"group.com.barolit.fixocargo","locale":"es-DO","currency":"RD$","weightUnit":"lb","fonts":{"head":"Myriad","body":"Myriad"},"radius":{"sm":8,"md":16,"lg":24},"assets":{"logoWide":"images/fixocargo/brand_logo.png","logoMark":"images/fixocargo/icon.png"},"palettes":{"light":{"primary":"#131D32","onPrimary":"#FFFFFF","secondary":"#FFB74D","onSecondary":"#2A1800","danger":"#B3261E"},"dark":{"primary":"#FFB74D","onPrimary":"#2A1800","secondary":"#7187B1","onSecondary":"#0E1525","danger":"#FF8A80"}},"capabilities":{"delivery":true,"payments":true,"points":true,"prealerts":true,"widgets":true,"notifications":true},"navigation":{"tabs":["news","branches","home","calculator","more"]}}
