{"schema":1,"slug":"cargowise","name":"CargoWise","tagline":"","bundleId":"com.barolit.cargowise","urlScheme":"cargowise","appGroup":"group.com.barolit.cargowise","locale":"es-DO","currency":"RD$","weightUnit":"lb","fonts":{"head":"Myriad","body":"Myriad"},"radius":{"sm":8,"md":16,"lg":24},"assets":{"logoWide":"images/cargowise/brand_logo.png","logoMark":"images/cargowise/icon.png"},"palettes":{"light":{"primary":"#203627","onPrimary":"#FFFFFF","secondary":"#CBDB2A","onSecondary":"#1D2104"},"dark":{"primary":"#88AA91","onPrimary":"#102016","secondary":"#D9E56E","onSecondary":"#1D2104"}},"capabilities":{"delivery":true,"payments":true,"points":true,"prealerts":true,"widgets":true,"notifications":true},"navigation":{"tabs":["news","branches","home","calculator","more"]}}
