{"schema":1,"slug":"domex","name":"Domex","tagline":"","bundleId":"com.barolit.domex","urlScheme":"domex","appGroup":"group.com.barolit.domex","locale":"es-DO","currency":"RD$","weightUnit":"lb","fonts":{"head":"Myriad","body":"Myriad"},"radius":{"sm":8,"md":16,"lg":24},"assets":{"logoWide":"images/domex/brand_logo.png","logoMark":"images/domex/icon.png"},"palettes":{"light":{"primary":"#F7D701","onPrimary":"#242000","secondary":"#000000","onSecondary":"#FFFFFF"},"dark":{"primary":"#F7DD4F","onPrimary":"#242000","secondary":"#F1F1F1","onSecondary":"#171717"}},"capabilities":{"delivery":true,"payments":true,"points":true,"prealerts":true,"widgets":true,"notifications":true},"navigation":{"tabs":["news","branches","home","calculator","more"]}}
