{"schema":1,"slug":"cps","name":"CPS","tagline":"","bundleId":"com.barolit.cps","urlScheme":"cps","appGroup":"group.com.barolit.cps","locale":"es-DO","currency":"RD$","weightUnit":"lb","fonts":{"head":"Myriad","body":"Myriad"},"radius":{"sm":8,"md":16,"lg":24},"assets":{"logoWide":"images/cps/brand_logo.png","logoMark":"images/cps/ic_launcher_foreground.png"},"palettes":{"light":{"primary":"#0065A1","onPrimary":"#FFFFFF","secondary":"#2F5069","onSecondary":"#FFFFFF"},"dark":{"primary":"#65A9D3","onPrimary":"#071C29","secondary":"#91AABC","onSecondary":"#15242D"}},"capabilities":{"delivery":true,"payments":true,"points":true,"prealerts":true,"widgets":true,"notifications":true},"navigation":{"tabs":["news","branches","home","calculator","more"]}}
